category,text
meeting,We're having an impromptu brainstorming session at 3 PM today in the creative lounge.
non-meeting,Please return any borrowed equipment before going on vacation.
meeting,The product demo meeting starts at 2:30 PM in the showcase room with potential clients.
meeting,All team members should join the knowledge sharing meeting at 9 AM Friday.
non-meeting,Please submit your department's annual report by the end of month.
meeting,The innovation planning session is set for 11:30 AM in the R&D strategy room.
meeting,The sales enablement training will start at 1 PM in the revenue acceleration center.
non-meeting,Your professional certification exam has been scheduled.
non-meeting,The office will be professionally cleaned this weekend.
meeting,The content syndication strategy session will take place at 11 AM in the distribution planning room.
non-meeting,Please update your emergency evacuation zone assignment in the system.
non-meeting,Your project risk assessment report needs review.
non-meeting,New training requirements for all customer-facing roles.
non-meeting,Employee discount tickets available for local sports event.
non-meeting,Please provide feedback on the new internal communication platform.
non-meeting,The parking permit renewal process begins next week.
meeting,The team building meeting will be held at 10 AM in the recreation room.
non-meeting,Your professional license renewal fee has been processed.
non-meeting,New sustainability goals announced for the upcoming year.
non-meeting,Please submit your vacation requests for the holiday season soon.
non-meeting,The company directory has been updated with new extensions.
meeting,All product managers must join the roadmap planning meeting at 1:30 PM tomorrow.
non-meeting,The company-wide town hall meeting recording is now available.
non-meeting,Please complete the cybersecurity assessment questionnaire by Wednesday.
meeting,The vendor review meeting is scheduled for 2:30 PM Thursday.
non-meeting,We've changed our process for scheduling conference rooms.
meeting,The diversity and inclusion committee will meet at 2 PM in the community center.
meeting,The annual budget meeting is scheduled for 12:30 PM Monday.
meeting,The budget defense meeting has been moved to 4 PM in the finance conference room.
non-meeting,Please submit receipts for reimbursement within 30 days of purchase.
non-meeting,We're pleased to announce the acquisition of XYZ Company.
meeting,The workflow optimization session is set for 4:30 PM in the process improvement center.
non-meeting,Your team's project dashboard has been updated with new metrics.
non-meeting,Changes to the document retention schedule announced.
non-meeting,We're pleased to announce our company's recent industry award.
meeting,The annual marketing budget planning is set for 4:30 PM in the investment strategy room.
non-meeting,Your request for flexible work arrangements has been processed.
non-meeting,New digital signature process for all contracts effective immediately.
non-meeting,The company-wide volunteering day is scheduled for next month.
non-meeting,The office carpet will be cleaned over the weekend.
non-meeting,Please submit your availability for the customer focus group.
non-meeting,The company directory has been updated with new team members.
non-meeting,Reminder: Submit nominations for employee recognition awards.
non-meeting,We're implementing a new document control system next quarter.
meeting,Reminder: Business continuity planning meeting at 4 PM in the risk management suite.
non-meeting,Building maintenance scheduled for this weekend. Access limited.
non-meeting,Please submit your expense reports for the quarter by Friday.
non-meeting,The building management has announced parking garage repairs.
meeting,Your input is needed at the product naming workshop at 11:30 AM tomorrow.
non-meeting,We're pleased to announce the opening of our new satellite office.
non-meeting,The deadline for health insurance open enrollment is approaching.
non-meeting,The annual compliance training deadline has been extended to June 15th.
meeting,Your team's data governance strategy session will take place at 9 AM in the information management center.
meeting,Your team's quarterly business review will take place at 10:30 AM in the performance assessment center.
meeting,The annual shareholders meeting will take place at 8:15 AM at the downtown Marriott.
non-meeting,Please submit your suggestions for the holiday party theme.
meeting,The data privacy training will start at 4:30 PM in the compliance education room.
meeting,The operational review meeting will start at 1 PM in the performance management center.
meeting,Please attend the security incident response meeting at 4:30 PM with IT Security.
non-meeting,We're introducing a new employee wellness challenge next month.
meeting,The board committee meeting will begin at 8:15 AM in the executive boardroom.
non-meeting,The deadline for submitting tuition reimbursement requests is approaching.
meeting,We're meeting at 11 AM to discuss the new product launch strategy.
non-meeting,We're excited to announce our company has achieved ISO certification.
non-meeting,Please review and comment on the draft marketing materials.
non-meeting,Your performance review meeting has been scheduled for next week.
non-meeting,We're excited to announce our expansion into international markets.
non-meeting,New benefits option available during open enrollment.
non-meeting,Changes to the sales commission structure announced.
non-meeting,Please submit your feedback on the new project management tool.
non-meeting,New procedure for requesting translation services.
non-meeting,Your document has been processed through workflow.
meeting,We're having a brief meeting at 2:30 PM to discuss workflow improvements.
non-meeting,Your requested software training has been scheduled.
non-meeting,Annual strategic planning documents available for review.
meeting,We're organizing a diversity and inclusion committee meeting at 10:15 AM in HR.
non-meeting,We've changed our process for requesting translation services.
meeting,All team leads should join the resource planning meeting at 11:15 AM Monday.
non-meeting,Please complete your annual compliance training by Friday.
meeting,All team members should join the retrospective meeting at 1:30 PM Monday.
non-meeting,Please submit your research paper abstracts for the company symposium.
non-meeting,Please remember to set your out-of-office message before vacation.
meeting,Please join the information security risk assessment at 11:30 AM in the cybersecurity planning center.
meeting,The content strategy meeting is set for 11:30 AM with the marketing department.
meeting,The project status meeting is scheduled for 8:30 AM tomorrow.
meeting,The quarterly forecast review meeting is scheduled for 9:15 AM in Finance.
non-meeting,Your team's budget for next fiscal year has been approved.
non-meeting,Please submit your recommendations for workflow improvements.
non-meeting,We've updated our email retention policy; details attached.
non-meeting,Please submit your department's annual report by the end of month.
meeting,Please bring your business requirements to the systems planning meeting at 10 AM tomorrow.
meeting,Please prepare your cost optimization initiatives for the efficiency review at 3 PM tomorrow.
non-meeting,Your request for software demonstration scheduled.
meeting,Please prepare your updates for the 3:30 PM status meeting Friday.
non-meeting,Your professional certification exam fee has been paid.
non-meeting,Your requested ergonomic assessment has been scheduled.
meeting,Please prepare questions for the vendor Q&A meeting at 3:45 PM Wednesday.
meeting,Reminder: Department heads meeting at 9 AM tomorrow in the executive boardroom.
non-meeting,We've exceeded our quarterly sales targets by 15%.
meeting,The data privacy compliance meeting is set for 8:45 AM with the security team.
non-meeting,Reminder: Complete the required ethics training module.
non-meeting,Your workstation will be upgraded to the new operating system next week.
meeting,Please join the ethics committee meeting at 3:30 PM in the governance conference room.
non-meeting,The cafeteria menu for next week is now available on the intranet.
non-meeting,The employee recognition program has been enhanced with new rewards.
non-meeting,Your professional license renewal has been processed successfully.
non-meeting,Please update your emergency contact information in the HR portal.
non-meeting,New digital signature process implemented for all contracts.
meeting,We need to discuss the project deadlines for this quarter. Join us at 3 PM today.
non-meeting,Your requested office supplies have been delivered to your desk.
non-meeting,We're pleased to announce a new wellness program starting next quarter.
non-meeting,The company volunteer day is scheduled for September 15th.
meeting,We need to discuss the project deadlines for this quarter. Join us at 3 PM today.
non-meeting,Your office furniture replacement has been approved.
non-meeting,We've revised our customer privacy policy; please review the updates.
non-meeting,Please review and update your direct deposit information if needed.
non-meeting,Please submit your feedback on the new project management tool.
non-meeting,The new employee orientation schedule has been posted.
non-meeting,Your request for flexible schedule has been processed.
non-meeting,Please review and approve the vendor selection recommendation.
non-meeting,Important announcement about company financial performance.
non-meeting,We've revised our corporate communications strategy; training available.
meeting,Your team's supply chain resilience meeting will take place at 2:30 PM in the logistics continuity center.
non-meeting,Your software license requires renewal by end of month.
meeting,Could everyone please attend the systems integration meeting at 2 PM in the IT conference room?
non-meeting,Your system upgrade has been completed successfully.
non-meeting,New recycling initiative starts next week. Sorting guidelines attached.
meeting,We're holding a crisis communication meeting at 2 PM following recent events.
meeting,The supply chain optimization meeting will start at 2:30 PM in the logistics planning center.
meeting,We're meeting to discuss the customer support quality assessment at 1:30 PM in the service excellence lab.
non-meeting,Your request for additional equipment has been approved.
meeting,The annual technology vendor assessment is set for 10:30 AM in the strategic sourcing center.
non-meeting,Important tax document available in your employee portal.
non-meeting,The quarterly compliance report has been submitted successfully.
non-meeting,Your sales figures for the last quarter have been finalized and are impressive.
meeting,The portfolio strategy alignment meeting will start at 10:30 AM in the product management center.
non-meeting,Your professional development course has been approved.
non-meeting,We're pleased to announce a new corporate partnership with ABC Charity.
non-meeting,Please provide feedback on the new intranet design.
non-meeting,Your performance review has been completed and is ready for your acknowledgment.
meeting,The quality assurance meeting will begin at 11:30 AM Thursday.
meeting,The diversity recruitment strategy session will begin at 9:30 AM in the talent acquisition center.
non-meeting,Your business cards with the updated company logo are ready for pickup.
non-meeting,Your requested transfer to the new department has been approved.
meeting,We need to review the project updates for the steering committee at 9 AM in the program management office.
non-meeting,Reminder: Clean your workspace before deep cleaning this weekend.
non-meeting,Your dependent verification for benefits is due by the end of the week.
non-meeting,Please review the draft of the annual stakeholder report.
meeting,Please join the employee career development workshop at 2 PM in the professional growth center.
non-meeting,The building security protocol has been enhanced; new procedures attached.
meeting,The quarterly forecast review is set for 9 AM in the financial planning center.
meeting,The annual technology assessment is set for 1:30 PM in the digital transformation center.
non-meeting,Your request for additional research tools has been approved.
non-meeting,The deadline for enrolling in the retirement savings plan is approaching.
meeting,Please prepare for the product demo meeting at 3:30 PM Thursday.
non-meeting,Your request for additional project funding has been approved.
meeting,Your department's risk management review is scheduled for 1:30 PM in the compliance center.
non-meeting,Your department budget for next fiscal year is ready for review.
non-meeting,Your requested time off has been approved by your manager.
meeting,The customer support quality assessment is scheduled for 4:30 PM in the service excellence center.
non-meeting,Please remember to submit your vacation requests at least two weeks in advance.
meeting,Please prepare your status updates for the 3:30 PM stand-up meeting.
meeting,The video conference meeting will begin at 8 AM sharp.
non-meeting,We're excited to announce the results of our innovation contest.
non-meeting,We're introducing new project management methodology training.
non-meeting,Important information about the company's carbon footprint initiative.
non-meeting,The gym facilities will be expanded starting next month.
non-meeting,Please remember to track all client billable hours accurately.
meeting,The marketing strategy meeting is scheduled for 2:55 PM Monday.
non-meeting,Building maintenance affecting north wing offices next week.
meeting,The customer feedback analysis meeting will take place at 11 AM with Marketing.
non-meeting,We're pleased to announce several internal promotions this month.
meeting,Don't forget to prepare your department updates for the 10:30 AM all-hands meeting on Friday.
non-meeting,Your requested ergonomic furniture has been approved.
meeting,Please attend the emergency budget meeting at 3:15 PM today.
meeting,The annual employee engagement survey results meeting will take place at 8:15 AM Friday.
non-meeting,The annual ethics certification must be completed by all employees.
meeting,The executive staff meeting will take place at 8:15 AM in the CEO's conference room.
meeting,Please attend the global expansion strategy session at 4 PM in the international growth office.
non-meeting,The company's flexible spending account provider has changed.
meeting,The product sunset criteria meeting is scheduled for 10 AM in the lifecycle management room.
non-meeting,Your team has been allocated additional resources for the critical project.
non-meeting,Congratulations to our sales team for exceeding their quarterly targets!
non-meeting,We're excited to announce a new partnership with Microsoft.
non-meeting,We're implementing a new document retention policy next quarter.
non-meeting,Your requested reference letter has been completed.
meeting,The change control board meeting is set for 9 AM in the project governance center.
meeting,The executive committee meeting has been rescheduled to 4:30 PM in the CEO's office.
non-meeting,Your professional association membership has been renewed.
non-meeting,We're switching to a new health insurance provider next month.
non-meeting,The office will be closed next Monday for the national holiday.
non-meeting,New mentorship program launching next quarter. Applications open.
non-meeting,New optional training courses available in the learning portal.
non-meeting,The cafeteria menu for next week has been posted on the intranet.
meeting,The brand health metrics review will start at 1:30 PM in the market research center.
non-meeting,The office plants will be replaced during the weekend.
meeting,Your department's strategic planning session will take place at 11:30 AM in Room 305.
non-meeting,Deadline extended for the innovation challenge submissions.
meeting,The global expansion strategy meeting will begin at 9:30 AM in the international growth center.
non-meeting,The deadline for submitting tuition reimbursement requests is approaching.
non-meeting,New wellness challenge starting next month. Registration open.
meeting,The executive leadership team meeting will take place at 8:30 AM in the board room.
meeting,Please bring talent acquisition plans to the HR meeting at 4 PM Monday.
meeting,The editorial calendar planning meeting will take place at 10:30 AM in the content strategy room.
meeting,The quarterly strategy meeting will be held at 10:45 AM Wednesday.
meeting,We're holding a post-implementation review meeting at 10 AM in the project room.
non-meeting,Your benefits enrollment confirmation is attached for your records.
non-meeting,The deadline for updating your retirement contribution is approaching.
non-meeting,The deadline for health insurance open enrollment is approaching.
non-meeting,The charity fundraising goal has been reached; thank you for your contributions!
meeting,Your team's workflow optimization meeting will take place at 4:30 PM in the process excellence center.
non-meeting,Volunteer opportunity: Community service day next month.
non-meeting,The company newsletter submissions are due by the end of the week.
non-meeting,Changes to the project approval process effective next month.
meeting,Please prepare a short presentation for the knowledge sharing session at 11:30 AM tomorrow.
non-meeting,Your department's budget forecasting worksheet is due Monday.
meeting,Your department's budget review will take place at 2:30 PM in the financial planning center.
non-meeting,Your software license renewal has been processed for another year.
non-meeting,New IT ticketing system launched. Instructions attached.
non-meeting,Your team has been selected for the pilot program.
non-meeting,Your project deadline has been extended to May 30.
meeting,The website analytics review meeting will begin at 4:15 PM in the digital lab.
meeting,The team building session will take place at 3:15 PM Thursday.
meeting,We're holding a knowledge transfer meeting at 1:15 PM with the development team.
non-meeting,Please submit your suggestions for the holiday party theme.
meeting,Please prepare your department data for the quarterly review meeting at 10:30 AM.
non-meeting,We've updated our data breach response plan; training scheduled.
meeting,Please confirm your availability for the client strategy meeting at 1:15 PM next week.
meeting,The technical architecture review will start at 1:30 PM in the systems design center.
meeting,The user research planning meeting will take place at 1:30 PM in the usability testing lab.
non-meeting,We've updated our data privacy policy; mandatory training scheduled.
non-meeting,Your requested software license has been purchased and activated.
non-meeting,We're excited to announce our new sustainability initiative.
non-meeting,Changes to the office cleaning schedule announced.
non-meeting,Reminder: Update emergency evacuation plan for your department.
non-meeting,Please submit your suggestions for the office improvement initiative.
meeting,We're having a team check-in meeting at 2:30 PM Monday.
meeting,Reminder: Technology roadmap meeting at 4 PM in the innovation center.
non-meeting,We're excited to announce the acquisition of XYZ Software Inc.
non-meeting,The office will be closed next Monday for the national holiday.
non-meeting,The deadline for health insurance open enrollment is approaching.
non-meeting,Company-wide initiative to reduce paper usage launches next week.
meeting,Your attendance is expected at the employee career development workshop at 3 PM tomorrow.
non-meeting,Please submit your team's space requirements for the next fiscal year.
non-meeting,New shuttle service schedule between campuses starting next month.
non-meeting,We're upgrading our customer feedback system next month.
non-meeting,The company anniversary celebration will take place next month.
meeting,The employee training program meeting starts at 2:15 PM in the learning center.
non-meeting,Your professional association membership has been renewed.
meeting,The planning committee meeting will begin at 1 PM in Conference Room B.
non-meeting,Equipment inventory audit scheduled for next week.
non-meeting,The deadline for health insurance enrollment is approaching. Please make your selections.
non-meeting,Please remember to submit your timesheet before the pay period closes.
meeting,Please attend the customer service meeting at 10:30 AM Monday.
non-meeting,Your professional license renewal notification received.
non-meeting,New diversity and inclusion initiatives announced. Learn more online.
meeting,Reminder: Data privacy compliance review at 1 PM in the governance conference room.
non-meeting,The deadline for submitting budget requests for next year is October 15th.
non-meeting,Your requested office supplies have been delivered to your desk.
meeting,Please join the employee wellness program planning at 1:30 PM in the benefits consultation room.
non-meeting,Important information about tax withholding requirements.
meeting,Your team building workshop has been scheduled for 11 AM in the recreation area.
non-meeting,Please review the competitive analysis report for the new market.
meeting,The customer advocacy program kickoff will begin at 3 PM in the ambassador engagement center.
meeting,We've scheduled a budget review meeting for 3:15 PM with the finance committee.
non-meeting,We've changed our policy for requesting business cards.
meeting,Please prepare your team's capacity forecast for the resource planning meeting at 2:30 PM tomorrow.
non-meeting,IT security alert: Watch out for suspicious emails requesting login credentials.
meeting,The supplier diversity initiative meeting will start at 9 AM in the procurement strategy room.
meeting,The team building activity planning meeting will take place at 10:30 AM in Room 202.
meeting,The annual shareholders meeting will commence at 10 AM in the Grand Ballroom.
non-meeting,Your department's operational metrics show significant improvement.
non-meeting,Please review the sales forecast for the upcoming quarter.
meeting,Don't miss the important security protocol briefing meeting at 11:30 AM in the training room.
non-meeting,Printer maintenance scheduled for tomorrow morning. Please plan accordingly.
non-meeting,New sustainability initiative: Composting starts in cafeteria next week.
non-meeting,New company logo files available in the brand resources folder.
non-meeting,Changes to the visitor management system effective Monday.
non-meeting,Building security enhancements scheduled for next week.
non-meeting,Please submit your suggestions for the team building activity.
non-meeting,Your new project assignments have been posted in the project portal.
non-meeting,Your requested ergonomic furniture has been approved.
non-meeting,"Please welcome our new team member, Alex Chen, starting next Monday."
non-meeting,Your professional development funds for the year have been allocated.
meeting,The project milestone meeting is scheduled for 11:45 AM tomorrow.
meeting,The innovation pipeline review is scheduled for 9:30 AM in the future initiatives lab.
meeting,The process improvement committee meeting is scheduled for 4 PM in the operational excellence room.
meeting,All project managers should join the timeline meeting at 1:30 PM tomorrow.
non-meeting,We're excited to announce our new diversity and inclusion program.
non-meeting,We've updated our internet usage policy; please review the changes.
meeting,The information security briefing will start at 10:30 AM in the cybersecurity center.
meeting,The team feedback session is scheduled for 11:30 AM Thursday.
meeting,We need all project managers to attend the resource allocation meeting at 4:30 PM Wednesday.
non-meeting,The building access card readers will be upgraded this weekend.
non-meeting,We're launching a new company blog and looking for contributors.
non-meeting,We've switched to a new payroll provider; direct deposit forms attached.
non-meeting,Your training completion certificate is ready for download.
meeting,Please attend the compliance training meeting at 4:30 PM tomorrow.
non-meeting,We've upgraded our customer relationship management system.
non-meeting,The office carpet will be cleaned over the weekend.
non-meeting,Changes to the cafeteria menu starting next week.
non-meeting,Your requested ergonomic furniture has been ordered.
non-meeting,Reminder: Update your W-4 information if your status has changed.
non-meeting,Please complete the workplace ergonomics assessment by Friday.
meeting,The annual shareholders meeting will begin at 8:30 AM at the downtown Hilton.
non-meeting,The new employee photos will be taken next Wednesday.
meeting,The new market opportunity assessment will take place at 11:30 AM in the growth strategy room.
non-meeting,Your access to the financial reporting system has been granted.
non-meeting,Your business travel insurance coverage has been renewed.
non-meeting,Please remember to submit your timesheet before the pay period closes.
meeting,The product roadmap planning meeting will run from 9 AM to 4 PM with breaks.
meeting,All department heads must join the budget allocation meeting at 2:15 PM Monday.
non-meeting,Please submit your department's space requirements for the new office.
meeting,The quarterly technology roadmap meeting is scheduled for 9:15 AM in IT.
non-meeting,Please submit your professional development plan by month-end.
meeting,We need all department representatives at the coordination meeting at 4:45 PM sharp.
non-meeting,Reminder: Submit your feedback on the software beta test.
non-meeting,Changes to the employee recognition program announced.
non-meeting,Please submit your monthly progress report by the end of the week.
non-meeting,Please submit your feedback on the beta version of our new product.
