category,text
non-meeting,The office will be painted during the upcoming holiday weekend.
meeting,The team performance review will take place at 11:30 AM Monday.
meeting,Please attend the security awareness refresher meeting at 3:15 PM in Training.
meeting,The new market opportunity assessment will take place at 10 AM in the growth strategy room.
non-meeting,We've updated our policy on accepting gifts from vendors.
meeting,The diversity recruitment strategy session will take place at 9 AM in the talent acquisition center.
non-meeting,We've updated our anti-harassment policy; training scheduled.
meeting,Please bring your process documentation to the workflow meeting at 1:15 PM Thursday.
meeting,Please attend the security awareness training meeting at 2:15 PM in Room 201.
non-meeting,Your project budget increase has been approved by finance.
meeting,The product roadmap meeting will begin at 10:30 AM in the innovation lab.
non-meeting,Company volunteer day scheduled for next quarter.
non-meeting,The shuttle bus schedule has been adjusted for the winter months.
non-meeting,We've revised our business travel policy; please review the changes.
meeting,Please bring process documentation to the workflow optimization meeting at 2:30 PM tomorrow.
non-meeting,Reminder: Complete your timesheet by Friday 5 PM.
meeting,The product quality metrics review will start at 3:30 PM in the excellence measurement center.
meeting,All team members must join the skills assessment meeting at 1:30 PM tomorrow.
meeting,The annual technology assessment is scheduled for 4 PM in the innovation lab.
non-meeting,Important update about upcoming regulatory changes affecting our industry.
non-meeting,The employee discount program now includes additional vendors.
meeting,The product demo meeting with potential clients will take place at 4:15 PM.
non-meeting,We're excited to announce the launch of our new product line.
meeting,The annual performance review meetings will be scheduled throughout next month.
non-meeting,Important announcement regarding company acquisition plans.
non-meeting,Reminder: Complete customer satisfaction follow-up calls.
meeting,Please prepare your team updates for the status meeting at 4:15 PM tomorrow.
non-meeting,New phone system features now available. Quick guide attached.
non-meeting,Reminder: Complete mandatory ethics training by month end.
meeting,The annual performance review calibration will begin at 2 PM in the talent assessment center.
non-meeting,We've updated our remote work equipment reimbursement policy.
non-meeting,We're looking for peer reviewers for technical documentation.
non-meeting,Reminder: Submit suggestions for the employee handbook update.
meeting,We're organizing a workflow optimization meeting at 1:15 PM in Operations.
meeting,We're holding a social media strategy meeting at 4 PM in the marketing conference room.
non-meeting,We've changed our process for ordering business cards.
non-meeting,The company picnic has been rescheduled due to the weather forecast.
meeting,Please prepare your project updates for the steering committee meeting at 1 PM tomorrow.
meeting,Please bring your market research findings to the planning meeting at 1:15 PM.
meeting,The customer feedback analysis meeting will begin at 3:30 PM in the voice of customer center.
non-meeting,We're introducing a new mentorship program for junior employees.
meeting,Please attend the training program development meeting at 3:15 PM in HR.
meeting,We need to discuss the marketing campaign results at 3 PM in the creative room.
non-meeting,We're proud to announce our company has been listed in the Top 100 Employers.
non-meeting,Annual employee award nominations now being accepted.
non-meeting,The WiFi network will be down for maintenance this Saturday from 10am-2pm.
non-meeting,Please update your skills profile for project assignment optimization.
non-meeting,We've changed our corporate travel booking process; details attached.
non-meeting,We're implementing a new electronic timesheet system next month.
meeting,The product launch meeting is scheduled for 10:30 AM in Conference Room G tomorrow.
non-meeting,Please complete the IT needs assessment survey.
non-meeting,Your license for design software will expire in 14 days.
non-meeting,Your requested software upgrade has been completed.
non-meeting,Changes to the sales commission structure. Details in attached document.
non-meeting,Reminder: Complete your annual self-assessment by next Friday.
meeting,The customer advisory panel meeting will take place at 10:15 AM in the experience center.
non-meeting,Reminder: Complete your annual health assessment for insurance discount.
meeting,Your department's risk assessment review is scheduled for 4 PM in the compliance planning room.
non-meeting,The company has been awarded a new government contract.
meeting,Please bring personnel requests to the budget meeting at 4:30 PM tomorrow.
meeting,We need to meet regarding the customer satisfaction metrics at 4:15 PM in Room 303.
meeting,Please bring your performance indicators to the metrics meeting at 4:15 PM Monday.
meeting,The board committee meeting will take place at 9:45 AM in the executive boardroom.
non-meeting,We're upgrading to the latest version of Microsoft Office next month.
meeting,The customer retention strategy meeting will begin at 10:30 AM in Conference Room E.
meeting,The quarterly forecast meeting will begin at 9 AM in the finance conference room.
meeting,You're invited to join the customer experience workshop at 11 AM in the design thinking space.
non-meeting,Your product demonstration materials have been prepared.
non-meeting,We're implementing a new digital asset management system next month.
non-meeting,Office temperature adjustments scheduled for next week.
meeting,The annual budget meeting is scheduled for 12:45 PM Monday.
meeting,The customer feedback session starts at 10 AM in the experience center.
non-meeting,Office relocation timeline updated. Move dates confirmed for July.
non-meeting,New employee referral bonus program now in effect.
non-meeting,Your approved overtime hours have been added to payroll.
non-meeting,Your request for a standing desk has been approved by facilities.
non-meeting,Office move timeline finalized. Department schedules attached.
non-meeting,Reminder: Return borrowed books to the company library.
meeting,Reminder: Cross-functional team meeting at 11:30 AM in the collaboration space.
meeting,All team members should join the retrospective meeting at 1:30 PM Friday.
non-meeting,Building security enhancement project starts next week.
non-meeting,Changes to the telecommunications expense reimbursement policy.
meeting,The quarterly earnings meeting will begin at 4:35 PM in the main hall.
meeting,The product feature prioritization meeting will begin at 8:15 AM in the product lab.
non-meeting,We've updated our corporate email signature template; please apply it.
non-meeting,We've updated our expense reimbursement limits; details attached.
non-meeting,The company-wide strategic planning results are now available.
non-meeting,We're implementing a new electronic document signing process.
non-meeting,The company vehicle fleet has been upgraded with hybrid models.
meeting,Please attend the customer support quality assessment at 2:30 PM in the service excellence center.
non-meeting,The parking validation system will be updated this weekend.
non-meeting,We're implementing a new learning management system next quarter.
meeting,The recruitment strategy meeting is set for 8:15 AM in the HR conference room.
non-meeting,Your professional development plan has been approved.
non-meeting,We're implementing a new corporate learning platform next month.
meeting,Please bring user research findings to the 3:45 PM product planning meeting.
meeting,Please prepare your department metrics for the performance meeting at 2:45 PM Monday.
non-meeting,Reminder: Complete your health assessment for insurance discount.
non-meeting,Your project has been selected for company showcase event.
meeting,Please attend the project timeline meeting at 10:55 AM Wednesday.
non-meeting,Please complete the IT security awareness training by the end of the month.
non-meeting,Your team's performance metrics for the quarter have been published.
non-meeting,New equipment training sessions available next week. Sign up now!
non-meeting,Reminder: Complete your health assessment for insurance discount.
non-meeting,Your certification is expiring next month. Please schedule your renewal.
non-meeting,The company's environmental impact report is now available.
meeting,We're having a project status meeting at 2:05 PM tomorrow.
non-meeting,The annual report has been finalized and is available for review.
non-meeting,Please submit your desk location preference for the upcoming move.
meeting,The security awareness training starts at 10:45 AM in the company auditorium.
non-meeting,Please clean your workspace before the office deep cleaning this weekend.
non-meeting,Your project documentation has been archived in the knowledge base.
non-meeting,We're implementing a new customer relationship management system.
non-meeting,The building access hours have been extended during the project crunch.
meeting,We need to align on the customer support strategy at 4:30 PM in the service excellence center.
non-meeting,Your travel arrangements for the client visit have been confirmed.
non-meeting,Your access to the customer database has been provisioned.
meeting,Please prepare a summary for the executive briefing meeting at 3:30 PM tomorrow.
meeting,The crisis management meeting is scheduled for 3:35 PM today.
non-meeting,We've created a new shared drive for cross-team collaboration.
meeting,The website performance optimization meeting is scheduled for 4:30 PM in the digital experience lab.
meeting,Please attend the security protocol review meeting at 4:30 PM with the IT team.
non-meeting,"Go until jurong point, crazy.. Available only in bugis n great world la e buffet... Cine there got amore wat..."
meeting,All department managers must join the budget defense meeting at 1 PM Thursday.
meeting,The annual planning session will begin at 8:45 AM in the main conference center.
meeting,The client presentation meeting will begin at 3:30 PM Monday.
non-meeting,The office equipment inventory audit begins next Monday.
non-meeting,Your business travel insurance coverage has been renewed.
non-meeting,Please remember to properly label all items in shared refrigerators.
meeting,The client onboarding meeting will take place at 2:30 PM in the customer lounge.
meeting,We're having a brief meeting at 2:30 PM to discuss workflow improvements Monday.
meeting,The international client meeting will be held via Zoom at 7 AM due to time zone differences.
meeting,We're meeting to discuss the international market entry plan at 1:30 PM in the global expansion office.
meeting,The product localization strategy session is scheduled for 10 AM in the global markets center.
non-meeting,The deadline for participating in the employee stock purchase plan is Friday.
meeting,Please join the risk management review at 9 AM in the compliance strategy office.
non-meeting,We've revised our pandemic response protocols; details attached.
non-meeting,Please submit your team's quarterly objectives by Friday.
non-meeting,The employee discount program now includes additional vendors.
meeting,The vendor negotiation meeting will start at 1:30 PM in the procurement office.
meeting,The quarterly forecast review meeting is set for 9:30 AM in the finance conference room.
non-meeting,We've updated our data breach response plan; training scheduled.
meeting,The customer retention analysis session will take place at 9 AM in the loyalty metrics center.
meeting,We're having a team sync meeting at 8:30 AM in the breakout room.
non-meeting,We've changed our process for scheduling conference rooms.
non-meeting,Please complete the technology needs assessment.
non-meeting,Reminder: Complete quarterly objectives documentation.
non-meeting,Please remember to submit your professional goals for the next quarter.
non-meeting,The results of the employee satisfaction survey are now available.
meeting,Please bring your ideas for process improvement to the lean workshop at 1 PM tomorrow.
non-meeting,Your timesheet approval for last week is still pending.
non-meeting,Company awards ceremony will be held virtually this year.
meeting,The product roadmap meeting will take place at 10:30 AM tomorrow.
meeting,We're gathering to discuss the competitive landscape at 10 AM in the market intelligence lab.
non-meeting,New discount program available for educational courses.
non-meeting,We've changed our process for requesting IT support.
non-meeting,The cafeteria will offer special menus during cultural awareness week.
non-meeting,Important announcement about office closure dates.
non-meeting,Your request for internship supervision has been processed.
meeting,We need all stakeholders at the project status review at 4:45 PM Wednesday.
non-meeting,Your patent application has been approved by the patent office.
meeting,The information security risk assessment is set for 9 AM in the cybersecurity planning room.
meeting,We're holding a quick alignment meeting at 2:30 PM to synchronize team efforts.
non-meeting,Reminder: Submit your peer recognition nominations.
meeting,Please join the customer segmentation workshop at 1 PM in the market strategy lab.
meeting,The design thinking workshop meeting will run from 10 AM to 2 PM with lunch provided.
non-meeting,Please submit your feedback on the new internal portal.
non-meeting,Security badges must be worn at all times while on company premises.
non-meeting,Your benefits statement for the previous year is now available online.
meeting,Please attend the customer feedback analysis session at 11 AM in the voice of customer lab.
meeting,We're holding a special meeting to welcome our new CEO at 4:30 PM in the town hall.
non-meeting,We've changed our process for ordering business cards.
non-meeting,Please review the draft of the product user manual for accuracy.
non-meeting,The new company intranet features will launch next week.
non-meeting,Your requested marketing materials have been approved.
meeting,The user testing review meeting will take place at 10 AM in the experience lab.
meeting,The content governance committee meeting will start at 2 PM in the information management room.
non-meeting,Reminder: Complete the brief survey about cafeteria services.
non-meeting,Please submit your mentoring program application by Friday.
non-meeting,Please submit your suggestions for improving workplace efficiency.
meeting,We're having a quick meeting at 2:30 PM to discuss project blockers.
non-meeting,Reminder: Return company equipment before your upcoming leave.
meeting,The board of directors meeting is scheduled for 8:15 AM in the executive suite.
meeting,Please prepare your innovation proposals for the R&D committee meeting at 1 PM tomorrow.
non-meeting,We're pleased to announce our company's expansion into the Asian market.
non-meeting,The office heating system will be under maintenance tomorrow.
non-meeting,We're implementing a new customer relationship management system.
meeting,Your team's work-life balance initiative planning will take place at 2 PM in the employee experience center.
non-meeting,New updates have been posted on the company website. Check out the blog for more information.
non-meeting,The deadline for submitting receipts for the fiscal year is next Friday.
non-meeting,We're implementing a new electronic document signing process.
non-meeting,Important information about upcoming benefits webinars.
meeting,Please prepare analytics data for the performance meeting at 3:30 PM Thursday.
non-meeting,New energy conservation measures implemented throughout building.
non-meeting,The quarterly compliance newsletter is now available on the intranet.
meeting,We're organizing a workplace safety committee meeting at 1:15 PM in Room 201.
meeting,All team managers must attend the conflict resolution training at 4:15 PM tomorrow.
non-meeting,Your building access card needs to be renewed by the end of the month.
non-meeting,Please clean your workspace before the deep cleaning service arrives.
non-meeting,Annual compliance certification due by end of quarter.
meeting,Please attend the compliance training refresher meeting at 4:15 PM tomorrow.
meeting,The client presentation preparation meeting is scheduled for 11:30 AM in the main boardroom.
non-meeting,The office will observe summer hours starting next Monday.
non-meeting,Important update about changes to health benefit providers.
meeting,Please join the employee wellness initiative meeting at 2:45 PM in the recreation area.
meeting,The vendor selection committee meeting starts at 10:15 AM in the procurement office.
non-meeting,Your continuing education credits have been recorded.
non-meeting,Your suggestion has been implemented. Thank you for your input!
meeting,Don't forget about the workflow optimization meeting at 1 PM in Operations.
non-meeting,The temporary access cards for visitors are now available at reception.
non-meeting,New vending machines installed in break areas. Feedback welcome.
meeting,Please prepare your team's accomplishments for the recognition meeting at 2 PM tomorrow.
meeting,The R&D committee meeting will start at 3:30 PM in the innovation management center.
meeting,The customer retention strategy meeting is scheduled for 9:30 AM in the loyalty program center.
non-meeting,Please review the draft of the customer communication templates.
non-meeting,New feature release in the project tracking system.
non-meeting,Thank you for your hard work on the Johnson project. The client is very pleased.
non-meeting,Reminder: Update your contact information if recently changed.
non-meeting,Company-wide training on new data privacy regulations next Tuesday.
non-meeting,Your equipment has been scheduled for maintenance next week.
non-meeting,Your requested reference materials have been delivered.
non-meeting,The holiday gift exchange sign-up deadline is this Friday.
meeting,The quarterly review meeting is scheduled for 9 AM Monday. Please be on time.
non-meeting,Company community service day scheduled for September. Sign up now!
meeting,The product feature prioritization meeting is set for 10:30 AM in the product lab.
non-meeting,We've updated the employee handbook; please review the changes.
meeting,The marketing campaign review meeting starts at 11:15 AM - please bring performance metrics.
meeting,We need to meet regarding the regulatory compliance at 11:30 AM with Legal.
non-meeting,The deadline for updating your retirement contribution is approaching.
meeting,Please attend the product roadmap prioritization session at 3 PM in the strategy alignment room.
non-meeting,We've changed our process for requesting technical documentation.
non-meeting,Your requested office supplies have been delivered to your desk.
non-meeting,Your department's operational review has been scheduled for Monday.
non-meeting,Reminder: Return any borrowed equipment before inventory check.
meeting,The quarterly performance meeting will begin at 9:30 AM Friday.
meeting,Please attend the customer service meeting at 10:30 AM Friday.
meeting,The quarterly performance review meetings will begin next Monday at 10 AM.
non-meeting,Please review the draft of the customer agreement and provide feedback.
meeting,Please join the compensation and benefits review at 2:30 PM in the total rewards center.
meeting,Please bring process documentation to the workflow optimization meeting at 11 AM tomorrow.
non-meeting,Your request for additional help has been approved.
meeting,The customer experience meeting will begin at 8:30 AM Thursday.
meeting,Please join the team alignment meeting at 9:15 AM in the collaboration zone.
meeting,Please bring your laptop to the data analysis workshop at 3 PM tomorrow.
non-meeting,We're excited to announce our company has achieved carbon neutrality.
non-meeting,We've updated our information security policy; review required.
non-meeting,Don't miss our seasonal clearance sale! Up to 70% off on selected items.
non-meeting,We're excited to announce our company has achieved ISO certification.
non-meeting,Your request for special accommodation has been processed.
meeting,We're having a quick meeting at 7:30 AM to discuss the day's priorities Thursday.
non-meeting,Changes to the interview evaluation form for hiring managers.
meeting,We're holding an urgent client issue resolution meeting at 3 PM in Customer Success.
meeting,The employee engagement initiative review is set for 11:30 AM in the culture center.
non-meeting,Please complete the workplace satisfaction survey by Friday.
non-meeting,Changes to the confidentiality agreement for all employees.
non-meeting,Your department's staffing budget has been increased for next year.
non-meeting,New centralized printing system launching next week.
non-meeting,The company-wide strategic goals for next year have been published.
meeting,We're meeting at 2:30 PM to discuss the upcoming system migration.
non-meeting,Congratulations to the product team for hitting their milestone early!
non-meeting,The printer in the marketing department is out of order until further notice.
non-meeting,Your request for career development conversation scheduled.
non-meeting,We're discontinuing support for Windows 7 effective next month.
non-meeting,The company charitable foundation contributions have been announced.
non-meeting,Your network password will expire in 7 days. Update now.
non-meeting,New employee onboarding buddy program seeking volunteers.
non-meeting,Your new telephone has been configured and is ready for use.
meeting,Your team's capacity planning meeting is scheduled for 10:30 AM in the resource management office.
meeting,The annual planning meeting is scheduled for 9:30 AM in the main hall tomorrow.
non-meeting,Please complete the mandatory cybersecurity training by month-end.
meeting,The quarterly all-hands meeting will begin at 9 AM in the company auditorium.
non-meeting,New health savings account options available during open enrollment.
non-meeting,The deadline for submitting training reimbursement forms is approaching.
non-meeting,We've updated our pandemic response protocols; details attached.
non-meeting,Your new security badges are ready for pickup at the front desk.
non-meeting,Changes to office cleaning schedule. Details attached.
non-meeting,The company-sponsored training catalog has been updated.
non-meeting,Workplace safety committee seeking new members. Apply by Friday.
meeting,The customer retention strategy session will take place at 4:30 PM in the loyalty program center.
non-meeting,The catering menu for company events has been updated.
non-meeting,Your security clearance has been processed and approved.
meeting,Reminder: Pricing committee meeting at 4 PM in the revenue optimization room.
non-meeting,Please remember to submit your reimbursement requests within 30 days.
meeting,The quarterly business review meeting will take place at 8:30 AM in the main boardroom.
meeting,The website redesign meeting is set for 11:15 AM with the design team.
non-meeting,The deadline for purchasing additional vacation days is approaching.
non-meeting,We've streamlined the expense approval workflow; training available.
non-meeting,We've revised our customer service standards; training scheduled.
non-meeting,Company picnic photos are now available on the internal network.
non-meeting,We're introducing a new health and wellness initiative next quarter.
non-meeting,We're excited to announce our new corporate social responsibility initiatives.
meeting,The client requirement meeting will begin at 10:30 AM Monday.
non-meeting,Please remember to log your overtime hours in the payroll system.
non-meeting,Office will close early at 3pm this Friday due to building maintenance.
non-meeting,The company is participating in the city-wide food drive next week.
non-meeting,The company has updated its parental leave policy. Details on the intranet.
non-meeting,The company's volunteer time off policy has been expanded.
non-meeting,Your equipment is due for replacement next quarter.
meeting,Your project milestone review is scheduled for 9 AM in the program management center.
non-meeting,Please review the client contract renewal terms before Thursday.
non-meeting,Please clean out your workspace before the office reconfiguration.
non-meeting,The deadline for submitting receipts for the fiscal year is approaching.
non-meeting,Your office furniture replacement has been scheduled for Friday.
meeting,Please attend the resource planning meeting at 4:30 PM Monday.
non-meeting,Reminder: Complete the annual compliance training by month-end.
meeting,We need to meet regarding the compliance requirements at 11:45 AM with Legal.
non-meeting,Please remember to track all client billable hours accurately.
non-meeting,The office will operate on summer hours starting June 1st.
non-meeting,New company policy on remote work has been published in the employee handbook.
non-meeting,Your requested equipment has been approved and will arrive next week.
meeting,Please join the employee engagement initiative meeting at 2:45 PM in HR.
meeting,The strategic account management meeting will begin at 4 PM in the client relationship office.
meeting,Your input is needed at the change control board meeting at 9:30 AM tomorrow.
meeting,Please join the diversity recruitment strategy session at 1 PM in the talent acquisition room.
non-meeting,The deadline for enrolling in commuter benefits is approaching.
meeting,The project prioritization meeting will start at 11:30 AM in the portfolio management office.
non-meeting,Please participate in the workplace satisfaction survey.
non-meeting,We're introducing flexible work hours starting next month.
