category,text
non-meeting,Company-wide sustainability initiative launches next month.
non-meeting,Changes to the office supply ordering process effective immediately.
meeting,The website redesign kickoff is scheduled for 10 AM in the digital experience studio.
non-meeting,The deadline for contributing to the retirement plan is approaching.
non-meeting,Your request for flexible work arrangements has been approved.
non-meeting,Please review the draft of the customer nurturing campaign.
non-meeting,Join us for our upcoming webinar on data science! Register now.
non-meeting,The deadline for health insurance open enrollment is next Friday.
non-meeting,New employee mentoring program accepting applications.
meeting,Your department's employee engagement initiative planning will take place at 3 PM in the workplace culture lab.
meeting,Please attend the crisis management training at 1 PM in the emergency response center.
non-meeting,Health insurance claims must be submitted by December 31 for reimbursement.
non-meeting,Your benefits enrollment period will begin next week. Please review your options.
non-meeting,The deadline for submitting health insurance claims is December 31st.
non-meeting,We're implementing a new identity management system next quarter.
non-meeting,The company's quarterly earnings report is now available.
meeting,Reminder: Corporate social responsibility committee meeting at 1:30 PM in the community impact center.
meeting,The product roadmap meeting is set for 1:30 PM with all stakeholders in the innovation lab.
meeting,Please prepare performance metrics for the review meeting at 3:30 PM Monday.
meeting,The quarterly objectives meeting is scheduled for 9:30 AM Thursday.
meeting,All project stakeholders should join the milestone meeting at 2:15 PM Thursday.
non-meeting,We've changed our process for requesting office supplies.
non-meeting,Reminder: Update your skills profile in the talent database.
non-meeting,The deadline for updating your tax withholding information is next week.
meeting,We're organizing a post-launch review meeting at 3:15 PM in Conference Room D.
non-meeting,We're implementing a new identity management system next quarter.
non-meeting,Important announcement about leadership speaker series.
non-meeting,Your software update request has been completed by IT.
meeting,All department representatives must attend the budget defense meeting at 3:15 PM.
meeting,The quarterly financial review will begin at 9:30 AM in the accounting conference room.
meeting,Your input is needed at the change management strategy session at 11 AM tomorrow.
non-meeting,The air conditioning system will be serviced this Wednesday.
non-meeting,The company newsletter submissions are due by the end of the week.
non-meeting,The quarterly business review documents have been finalized.
meeting,All project managers should join the coordination meeting at 9:25 AM.
non-meeting,New sustainability initiative seeking department champions.
non-meeting,The wellness program participation rate has reached an all-time high.
meeting,The talent acquisition strategy session is scheduled for 1:30 PM in the recruitment planning center.
meeting,The technology infrastructure roadmap review is scheduled for 3 PM in the IT planning center.
meeting,All department representatives must join the cross-functional meeting at 1 PM sharp.
non-meeting,The building's HVAC system will be upgraded over the weekend.
non-meeting,The company has achieved ISO 27001 certification for information security.
meeting,All department heads must join the budget allocation meeting at 1:30 PM Thursday.
meeting,Your presence is requested at the customer insights workshop at 11 AM tomorrow.
meeting,Please prepare a status update for the board preparation meeting at 4 PM tomorrow.
non-meeting,Congratulations! You've won a $100 Amazon gift card.
non-meeting,Reminder: Update personal information in payroll system.
meeting,The quarterly business review meeting is set for 8:45 AM in the executive boardroom.
meeting,We're gathering to discuss the technology vendor assessment at 2:30 PM in the strategic sourcing office.
meeting,The client onboarding process meeting will begin at 11:30 AM in Conference Room A.
meeting,The board committee meeting is set for 8 AM in the executive conference room.
non-meeting,The deadline for updating beneficiary information is approaching.
non-meeting,The company-wide fitness challenge begins on Monday.
non-meeting,Your access to archived projects has been granted.
non-meeting,The deadline for completing the annual skills assessment is approaching.
meeting,The department update meeting will take place at 9:30 AM Thursday.
meeting,The environmental impact assessment review is scheduled for 3 PM in the sustainability center.
non-meeting,We've updated our workplace safety procedures; please review.
non-meeting,New office supplies catalog now available. Note pricing changes.
non-meeting,Your performance improvement plan progress review is scheduled.
non-meeting,Your certification has been added to your employee profile.
non-meeting,The maintenance team will be servicing the air conditioning system tomorrow.
non-meeting,Important announcement about leadership team changes.
non-meeting,Please submit your ideas for reducing operational costs.
meeting,We need to review the quarterly team recognition at 2 PM in the appreciation center.
non-meeting,I've reviewed your draft and have a few suggestions for improvements.
meeting,We're holding a contingency planning meeting at 1:15 PM in the crisis room.
non-meeting,Your application for professional development funding has been approved.
meeting,The customer escalation review meeting will begin at 11:30 AM with the support team.
non-meeting,We're upgrading the payroll system. Please verify your information is correct.
non-meeting,The network will be down for maintenance this Saturday from 10pm-2am.
meeting,The investor relations meeting is scheduled for 1:15 PM with the finance team.
non-meeting,Your dependent verification for benefits is due this week.
non-meeting,We're implementing a new sustainability initiative next quarter.
meeting,The annual strategy meeting is scheduled for 8:15 AM at the offsite location.
meeting,The UX research planning session is set for 11:30 AM in the user insights lab.
meeting,Please prepare for the financial review meeting at 11:55 AM tomorrow.
non-meeting,We're implementing a new procurement system next month.
non-meeting,The company charitable foundation contributions have been announced.
non-meeting,Your team has been recognized for operational excellence.
meeting,We need to align on the diversity and inclusion initiatives at 4:30 PM in the equity strategy center.
non-meeting,Changes to the expense reimbursement policy. Details attached.
non-meeting,We're implementing a new talent management system next month.
meeting,The digital accessibility planning session will start at 3 PM in the inclusive experience lab.
non-meeting,We've changed our process for scheduling conference calls.
non-meeting,Please remember to log all customer interactions in the new system.
non-meeting,Your equipment has been scheduled for preventive maintenance.
non-meeting,Please update your profile photo in the company directory.
non-meeting,Please submit your ideas for the company's 25th anniversary celebration.
non-meeting,Please remember to complete your self-assessment before your review.
non-meeting,Your order of business cards has been placed and will arrive next week.
non-meeting,Your skill certification has been added to your profile.
meeting,Please prepare market analysis for the planning meeting at 3 PM Monday.
meeting,The R&D planning meeting will start at 9 AM in the innovation strategy room.
non-meeting,We're implementing a new inventory management system next quarter.
meeting,The vendor management meeting starts at 2 PM with the procurement department.
non-meeting,Your vacation request for July 15-22 has been approved.
non-meeting,Please remember to properly secure your workstation before leaving.
meeting,The brand strategy meeting is set for 10:15 AM in the marketing conference room.
meeting,Please attend the data governance meeting at 3:15 PM with the information management team.
meeting,Please prepare financial projections for the forecast meeting at 3 PM Wednesday.
non-meeting,Your professional development funds approval process changed.
meeting,Please bring market analysis to the strategy meeting at 4:45 PM tomorrow.
meeting,The cross-functional team meeting has been rescheduled to 1 PM in Conference Room D.
non-meeting,The company blood drive will take place next Wednesday in the main lobby.
non-meeting,The quarterly financial reports are now available in the shared drive.
meeting,We're gathering to discuss the customer experience metrics at 1:30 PM in the CX measurement center.
meeting,Your department's strategic planning session is scheduled for 2:30 PM in the long-range planning room.
non-meeting,Your contribution to the charity campaign is greatly appreciated.
meeting,The customer experience meeting will take place at 8:30 AM tomorrow.
non-meeting,The company charitable giving program has been enhanced.
meeting,Your attendance is expected at the crisis management tabletop exercise at 10 AM tomorrow.
non-meeting,We're experiencing technical difficulties with the email server. IT is working on it.
non-meeting,The company matching gift program for donations has been increased.
non-meeting,Office relocation FAQ document now available.
meeting,The acquisition integration meeting will begin at 9:30 AM with both leadership teams.
meeting,Please attend the compliance review meeting at 10:35 AM Friday.
non-meeting,Please submit your feedback on the new project management tool.
meeting,Please join the team retrospective meeting at 9:30 AM in the project room.
meeting,The executive planning meeting has been rescheduled to 9:45 AM in the strategy room.
meeting,We're gathering to discuss the annual security assessment at 10 AM in the risk evaluation room.
meeting,The brand positioning workshop will begin at 1:30 PM in the market differentiation lab.
meeting,Reminder: Environmental impact committee meeting at 10 AM in the sustainability strategy room.
meeting,Please bring your user research findings to the product meeting at 4:15 PM.
non-meeting,Company holiday schedule for next year now available.
meeting,The annual marketing budget allocation is set for 1:30 PM in the investment planning room.
meeting,The customer journey mapping meeting will begin at 10:15 AM in the design lab.
meeting,The annual planning retreat will take place at 9:30 AM at the offsite conference center.
non-meeting,Please return any company equipment before your last day.
non-meeting,The annual company picnic has been rescheduled due to weather concerns.
non-meeting,New wellness challenge starting next week. Registration open.
non-meeting,We're introducing a new knowledge management system next month.
non-meeting,Reminder: Submit your health screening results for wellness discount.
meeting,The strategic initiative review meeting will take place at 2:15 PM in the war room.
meeting,Please prepare for the product demo meeting at 3:30 PM tomorrow.
meeting,The website analytics review session starts at 2 PM with the digital marketing team.
non-meeting,New employee discount program with local retailers.
non-meeting,The cafeteria has introduced a new online ordering system.
non-meeting,Please remember to update your voicemail message before vacation.
meeting,All department representatives must attend the compliance meeting at 8 AM sharp.
non-meeting,We've updated our logo usage guidelines; new assets available.
non-meeting,We've revised our business travel policy; please review before booking.
non-meeting,Your team has been selected for the pilot program.
meeting,The client onboarding meeting will take place at 8:30 AM tomorrow.
non-meeting,Your new laptop has been configured and is ready for pickup.
non-meeting,We've changed our process for requesting translation services.
meeting,The compensation and benefits review will start at 4:30 PM in the total rewards center.
non-meeting,Your business travel insurance coverage has been renewed.
non-meeting,Your team's quarterly performance metrics are now available for review.
meeting,Your team's corporate sustainability planning will take place at 2 PM in the environmental strategy center.
non-meeting,Changes to the employee discount program. New vendors added.
meeting,The budget review meeting has been moved to 2 PM on Friday.
meeting,The cybersecurity risk assessment meeting will take place at 10:30 AM in the threat intelligence center.
non-meeting,Looking for volunteers to join the social committee. Reply if interested.
meeting,The customer feedback session is set for 11:15 AM in the experience center.
non-meeting,Changes to the interview process for new candidates.
meeting,The annual strategic planning meeting will take place from 9 AM to 5 PM at the resort.
meeting,The annual company direction meeting will begin at 3 PM in the main conference center.
meeting,All team leads must join the resource allocation meeting at 2:15 PM tomorrow.
non-meeting,Reminder: Return company property before extended leave.
meeting,We're holding the project post-mortem meeting at 2 PM in Conference Room C.
meeting,Please attend the security protocol review meeting at 3:15 PM with the IT team.
non-meeting,The deadline for updating your commuter benefit elections is approaching.
non-meeting,Please remember to return temporary access badges to security.
non-meeting,Reminder: Submit nominations for the employee recognition program.
non-meeting,Please complete the information security awareness training.
non-meeting,Your request for professional journal subscription approved.
meeting,Please prepare your team's metrics for the KPI review meeting at 3 PM tomorrow.
non-meeting,Your security access level has been upgraded as requested.
meeting,The brand positioning workshop will begin at 2:30 PM in the market differentiation lab.
non-meeting,We're pleased to announce promotions for several team members.
meeting,The customer acquisition strategy meeting will take place at 11:15 AM in Marketing.
meeting,All managers should attend the leadership development meeting at 1:30 PM Monday.
non-meeting,Your professional development funds for the year have been allocated.
non-meeting,Your requested training materials have been delivered.
non-meeting,Your department's operational metrics have been updated.
meeting,The systems architecture governance review is set for 9 AM in the technical planning center.
non-meeting,Your project has been selected for the quarterly showcase.
non-meeting,Your security training certification expires next week.
non-meeting,The company's environmental impact report is now available.
meeting,The executive vision meeting is scheduled for 8:15 AM in the strategic planning room.
non-meeting,New phone system features tutorial now available.
non-meeting,We're excited to announce the opening of our employee fitness center.
meeting,The technical architecture review will start at 11:30 AM in the systems design lab.
non-meeting,The company's investment in renewable energy sources has increased.
non-meeting,The office kitchen will be renovated next month.
non-meeting,Congratulations to Team Alpha for exceeding their quarterly targets!
non-meeting,Important update about changes to health benefit providers.
non-meeting,Reminder: Complete your annual self-assessment.
meeting,The international expansion strategy session starts at 10 AM via video conference.
non-meeting,The annual security badge renewal process begins next week.
meeting,Please join the customer persona development session at 2 PM in the marketing lab.
non-meeting,We've installed new water dispensers throughout the building.
non-meeting,Please complete the cybersecurity awareness training by Friday.
non-meeting,Please submit your emergency evacuation role preferences.
non-meeting,The company stock performance report is now available.
non-meeting,Please remember to log out of your workstation when leaving the office.
non-meeting,Request for feedback: Please complete the customer satisfaction survey.
meeting,The digital transformation strategy meeting is set for 11:15 AM in the innovation lab.
meeting,Please prepare your performance metrics for the review meeting at 4:15 PM Thursday.
meeting,The customer journey mapping workshop will begin at 9:45 AM in the design studio.
non-meeting,The office building will undergo maintenance this weekend. Please secure your belongings.
meeting,All stakeholders should join the review meeting at 1:30 PM Monday.
non-meeting,The annual inventory count will take place next weekend.
meeting,We've scheduled a vendor selection meeting for 3 PM with the procurement team in Room 204.
meeting,Reminder: Staff training session at 9:30 AM in the learning center.
non-meeting,Your security clearance has been renewed for another year.
non-meeting,Your request for career counseling has been scheduled.
meeting,The team feedback meeting will take place at 3:25 PM.
meeting,Please prepare for the quarterly review meeting at 11:30 AM Monday.
non-meeting,Your request for additional storage space has been processed.
non-meeting,Your marketing materials order has been received and is being processed.
non-meeting,Changes to the employee assistance program resources.
non-meeting,Please clean out the communal refrigerator by Friday evening.
meeting,The quarterly business review meeting will begin at 8:15 AM with the executive team.
non-meeting,Your requested PTO has been approved. Enjoy your time off!
meeting,We're having a team check-in meeting at 8:25 AM in Conference Room D.
non-meeting,The new client onboarding process documentation is now available.
non-meeting,Please review and approve the draft contract by tomorrow.
meeting,The sales enablement training session will start at 11:30 AM in the learning development lab.
meeting,The annual planning meeting will take place at 8:15 AM Monday.
non-meeting,Company stock purchase plan enrollment period begins Monday.
non-meeting,Please review and update your direct deposit information if needed.
non-meeting,The office temperature settings have been adjusted for summer.
non-meeting,Your annual leave balance needs to be used before the end of the fiscal year.
meeting,Please prepare your quarterly objectives for the OKR meeting at 9:45 AM.
non-meeting,We've upgraded our customer support ticketing system.
non-meeting,Your team has been selected for the pilot of our new software.
meeting,The customer experience meeting is scheduled for 8:30 AM Wednesday.
meeting,We need to review the technology roadmap at 10:30 AM in the IT strategy room.
non-meeting,The office furniture will be replaced during the upcoming renovation.
meeting,Please attend the annual strategic initiative review at 10 AM in the enterprise planning room.
non-meeting,Please complete the industry benchmark survey by Friday.
meeting,Please prepare your project updates for the steering committee meeting at 9:30 AM tomorrow.
non-meeting,We're implementing a new inventory management system next week.
non-meeting,Changes to the shipping and receiving procedures.
non-meeting,The deadline for the tuition assistance program application is approaching.
meeting,The user feedback analysis meeting is set for 11:15 AM in the product lab.
meeting,Reminder: Information security risk assessment at 3 PM in the cybersecurity planning center.
non-meeting,Important update on industry regulations affecting our business.
meeting,Please attend the information security meeting at 3:15 PM with the security team.
non-meeting,Important software update available. Please install before Friday.
non-meeting,The office will be professionally cleaned this weekend.
non-meeting,The office furniture replacement project begins next week.
non-meeting,The office equipment inventory audit begins next Monday.
meeting,We need to align on the accessibility compliance review at 9 AM in the inclusive design center.
non-meeting,We're implementing a new document retention policy effective July 1.
non-meeting,We've changed our process for ordering business cards.
meeting,The executive staff meeting has been rescheduled to 4 PM in the president's office.
non-meeting,The deadline for submitting healthcare claims is approaching.
non-meeting,We're recruiting for a new position in marketing. Please share with qualified candidates.
non-meeting,The deadline for updating your tax withholding form is approaching.
non-meeting,Your equipment loan agreement expires at the end of the month.
meeting,The customer experience improvement meeting will take place at 11:15 AM in UX.
non-meeting,We've launched a new employee discount program with local businesses.
non-meeting,Reminder: Return your temporary access card to security.
meeting,The process improvement committee meeting will begin at 10 AM in the operational excellence office.
non-meeting,Please submit your suggestions for improving the onboarding process.
meeting,The team building session will take place at 3:30 PM tomorrow.
non-meeting,Your team's budget allocation for Q4 has been approved.
non-meeting,Reminder: Clean out the shared refrigerator before the weekend.
non-meeting,Please submit your team's innovation challenge entry by May 31.
non-meeting,Your access to the customer database has been provisioned.
meeting,The quarterly market analysis meeting is scheduled for 9:15 AM in Room 303.
non-meeting,The employee recognition program has been enhanced with new rewards.
non-meeting,The updated organization chart is now available on the company intranet.
non-meeting,Changes to employee discount program. New partners added!
meeting,Your project's product feature prioritization workshop will take place at 11 AM in the value assessment center.
non-meeting,Your security access level has been upgraded as requested.
non-meeting,We're pleased to announce our new corporate social responsibility program.
non-meeting,New phone system training sessions available next week.
non-meeting,Reminder: Update your emergency evacuation role.
meeting,Your team's OKR alignment session will take place at 9 AM in the objectives room.
non-meeting,Please complete the mandatory information security training.
meeting,Don't forget about the team retrospective meeting at 1:15 PM in the collaboration zone.
meeting,We need to align on the corporate sustainability goals at 11:30 AM in the environmental strategy room.
non-meeting,We've revised our customer privacy policy; please review the updates.
non-meeting,The office supply cabinet has been restocked with new items.
meeting,We've scheduled a customer feedback analysis session for 10:30 AM in the experience lab.
meeting,Your team's OKR alignment meeting is scheduled for 2:30 PM in the goal management room.
meeting,The resource allocation meeting will start at 2 PM in the capacity planning center.
non-meeting,Your requested office relocation has been scheduled for next week.
meeting,The annual marketing effectiveness review is set for 9 AM in the performance analysis center.
meeting,Please attend the brand positioning workshop at 2:30 PM in the marketing studio.
meeting,The quarterly financial review meeting will take place at 10 AM with the finance team present.
non-meeting,The office will close early on Friday for building maintenance.
meeting,The quarterly sales meeting is scheduled for 9:30 AM in the auditorium Wednesday.
non-meeting,Please complete the conflict of interest disclosure form by Friday.
meeting,The systems architecture governance review will start at 3:30 PM in the technical planning room.
meeting,We're having a quick meeting at 2:30 PM to discuss project blockers Monday.
non-meeting,Your requested training materials have arrived and are at reception.
meeting,The customer experience meeting will begin at 8:30 AM Thursday.
non-meeting,We're pleased to announce several internal promotions this quarter.
non-meeting,Reminder: Return security badges if leaving early on Friday.
meeting,The quarterly sales forecast meeting will begin at 11:15 AM in the war room.
non-meeting,Please review the user acceptance testing results for the new application.
meeting,The team feedback session will begin at 11:30 AM Thursday.
meeting,We've scheduled a compliance audit preparation meeting for 3:30 PM with Legal and Finance.
non-meeting,We've switched to a new vendor for office supplies.
non-meeting,We're implementing a new corporate communications platform.
meeting,The board of directors meeting will begin at 9 AM sharp in the executive suite.
meeting,The product roadmap prioritization is scheduled for 4 PM in the strategy alignment room.
non-meeting,The office carpet will be cleaned over the weekend.
non-meeting,Your request for additional office supplies has been approved.
meeting,Meeting with the IT department at 1:30 PM to discuss system upgrades.
non-meeting,Your laptop replacement is scheduled for next Tuesday morning.
non-meeting,Reminder: Submit your ideas for cost reduction initiatives.
meeting,The product roadmap prioritization meeting will start at 11:30 AM in the strategy alignment room.
non-meeting,Please remember to complete your daily health attestation form.
non-meeting,The fire drill is scheduled for tomorrow at 10:00 AM.
non-meeting,The quarterly business review presentation is now available.
non-meeting,We're experiencing shipping delays due to the severe weather conditions.
non-meeting,The office will be implementing new recycling stations next week.
non-meeting,The company-wide strategic goals for next year have been published.
meeting,The product launch meeting will take place at 2:45 PM next week.
non-meeting,We've implemented a new data security protocol effective immediately.
non-meeting,Your security clearance has been renewed for another year.
