category,text
non-meeting,Changes to the product return policy effective next month.
non-meeting,Health and safety inspection scheduled for next month.
non-meeting,Building evacuation routes updated. New maps posted throughout office.
meeting,The marketing strategy meeting will begin at 10:30 AM Friday.
non-meeting,Changes to the customer feedback collection process.
non-meeting,Your equipment maintenance is overdue. Please schedule service.
non-meeting,Please submit your team's quarterly objectives by Friday.
non-meeting,Changes to the visitor policy effective immediately. See attached guidelines.
meeting,Your presence is required at the crisis management meeting at 4 PM in the situation room.
non-meeting,Reminder: Submit article ideas for the company newsletter.
meeting,The client requirement meeting will take place at 10:30 AM Thursday.
meeting,The board advisory committee meeting will take place at 9:45 AM in the executive room.
non-meeting,We're excited to announce our corporate rebrand initiative.
non-meeting,Reminder: Review and update your beneficiary information annually.
meeting,Please prepare financial data for the budget meeting at 3:30 PM tomorrow.
non-meeting,Important changes to the visitor registration process.
non-meeting,The loading dock will be closed for maintenance tomorrow.
meeting,The client onboarding process meeting will take place at 10:15 AM in Room A.
non-meeting,Please remember to properly dispose of confidential documents.
meeting,The quarterly forecast meeting is scheduled for 9:15 AM in the finance conference room.
meeting,Please attend the hiring plan review meeting at 3:15 PM in the HR conference room.
meeting,The engineering team sync is scheduled for tomorrow at 2 PM in the development lab.
meeting,Please join the accessibility implementation planning at 4:30 PM in the inclusive design center.
meeting,The investor update meeting will begin at 9 AM in the executive conference room.
meeting,The quarterly objectives meeting will take place at 4:55 PM.
non-meeting,Your password will expire in 5 days. Please update.
non-meeting,The fire alarm test has been rescheduled to Wednesday at 10am.
non-meeting,Please submit your timesheet before leaving for vacation.
meeting,Your attendance is required at the compliance training at 10 AM on Wednesday.
non-meeting,New sustainability initiative launching next month. Learn how to participate.
non-meeting,We're excited to announce our new diversity and inclusion initiatives.
meeting,Your team's workload balancing meeting is scheduled for 10 AM in the capacity management center.
non-meeting,Your contract has been extended for another six months.
meeting,Please prepare your growth initiatives for the strategy meeting at 4:15 PM Monday.
non-meeting,Please remember to lock your computer when away from your desk.
non-meeting,The office kitchen rules have been updated; please review.
meeting,Please prepare your team updates for the status meeting at 2:15 PM tomorrow.
non-meeting,Your professional certification expires next month - renewal information attached.
non-meeting,We've changed our process for requesting software licenses.
non-meeting,Your department's operational metrics have been updated.
non-meeting,Your parking permit has been renewed for the coming year.
meeting,Don't miss the important customer retention planning at 8:45 AM in Marketing.
meeting,Please prepare your presentations for the 11:25 AM meeting.
meeting,Your 1-on-1 with your manager has been scheduled for 4 PM today.
non-meeting,Volunteer opportunity: Join us for the community cleanup day this Saturday.
non-meeting,Important update on industry regulations affecting our business.
non-meeting,Your project milestone has been successfully completed.
non-meeting,Company-wide cybersecurity alert: Update your passwords immediately.
non-meeting,Your department's operational review has been scheduled for next month.
non-meeting,Your request for flexible work arrangements has been approved.
non-meeting,We're pleased to announce our company's ISO recertification.
non-meeting,The company directory photos will be updated next month.
non-meeting,Your team's strategic planning session is scheduled for next week.
meeting,The annual planning retreat will take place next Friday from 8 AM to 5 PM.
meeting,We're gathering to discuss the customer feedback analysis at 2:30 PM in the voice of customer center.
non-meeting,We're implementing a new supply chain management system next month.
non-meeting,Your requested ergonomic assessment has been scheduled for Monday.
non-meeting,New digital asset management system launching soon.
non-meeting,We've updated our social media guidelines for employees.
non-meeting,Please submit your preference for the holiday work schedule by November 1.
meeting,Your attendance is required at tomorrow's compliance training meeting at 9 AM in the auditorium.
non-meeting,Your health insurance card has been mailed to your home address.
non-meeting,Please review the revised mission and vision statements.
non-meeting,Your continuing professional education credits have been approved.
non-meeting,The deadline for submitting dependent verification documents is approaching.
non-meeting,Your new business cards have arrived and are available at the reception desk.
non-meeting,The printer codes have been updated; see the IT portal for your new code.
meeting,The website analytics meeting will begin at 11:15 AM with the digital team.
non-meeting,New process for submitting customer escalations effective immediately.
meeting,Please join the ethics and compliance training planning at 4 PM in the governance education center.
non-meeting,Your team's recognition awards have been announced.
non-meeting,Reminder: Return loaner equipment to IT department.
non-meeting,Changes to the business continuity plan procedures.
non-meeting,We've revised our business continuity plan; training sessions available.
non-meeting,The annual employee appreciation event will be held on June 15.
non-meeting,Reminder: Review and verify your benefit elections.
non-meeting,Please update your emergency contact information in the HR portal.
non-meeting,New team collaboration tools available. Training sessions scheduled.
meeting,The customer experience improvement meeting will begin at 10:30 AM in the journey mapping lab.
non-meeting,Please submit your work hours for the pay period by Thursday.
meeting,The product feature prioritization meeting will start at 3:30 PM in the decision room.
non-meeting,Your team has been selected for the new product development initiative.
non-meeting,Please confirm your dietary restrictions for the company luncheon.
non-meeting,Your professional license renewal fee has been processed.
meeting,All regional managers must join the territory alignment meeting at 2:15 PM Thursday.
meeting,Please prepare quarterly results for the stakeholder meeting at 3 PM Wednesday.
meeting,Your team's diversity recruitment strategy session will take place at 3 PM in the talent acquisition center.
meeting,The quarterly sales forecast meeting is set for 9:30 AM in the sales conference room.
meeting,Don't miss the important resource allocation meeting at 1:30 PM in the project office.
non-meeting,We're implementing a new document control system next quarter.
meeting,The executive committee meeting will take place at 8:15 AM in the president's office.
meeting,The client presentation preparation is scheduled for 11 AM in the main boardroom.
meeting,We're meeting to discuss the accessibility compliance requirements at 9:30 AM in the inclusive design center.
non-meeting,We're pleased to announce our company's fifth consecutive year of growth.
meeting,The vendor selection meeting has been rescheduled to 4 PM in the procurement office.
non-meeting,We're pleased to announce that we've reached our annual charity goal.
non-meeting,We've updated our anti-harassment policy; training scheduled.
non-meeting,Your certification exam has been scheduled for next Tuesday.
non-meeting,Your professional development plan has been approved by management.
non-meeting,Please remember to log your vacation days in the HR system.
meeting,Your presence is required at the merger integration planning at 11 AM in the transition management office.
non-meeting,Your network account password requires updating.
meeting,Please attend the resource allocation meeting at 10:25 AM.
meeting,We're organizing a retrospective meeting at 1:15 PM to discuss Q1 performance.
non-meeting,Please submit your suggestions for the company slogan contest.
non-meeting,We're implementing a new procurement system effective immediately.
non-meeting,Reminder: Register devices with IT security department.
meeting,The quarterly objectives meeting will begin at 9:30 AM Thursday.
meeting,Your quarterly financial review with department heads will take place at 2:30 PM in the budget alignment room.
non-meeting,Your input on the new marketing materials would be appreciated.
non-meeting,Reminder: Update contact information for emergency notifications.
meeting,Your project risk assessment meeting is scheduled for 3:30 PM in Conference Room D.
meeting,The user research planning meeting is set for 9 AM in the customer insights lab.
non-meeting,We've revised our document retention policy; details attached.
non-meeting,New commuter benefits program launching next month. Details attached.
meeting,The quarterly objectives meeting will take place at 9:30 AM Monday.
meeting,The vendor selection committee meeting will take place at 11 AM in Procurement.
non-meeting,We're implementing a new electronic expense reporting system.
meeting,Please join the Zoom meeting at 2 PM using the link provided below.
meeting,The vendor performance evaluation meeting will take place at 10:15 AM in Procurement.
non-meeting,We've changed our process for requesting technical support.
non-meeting,New wellness program benefits available starting next month.
meeting,The efficiency initiative planning session is set for 1 PM in the operational excellence center.
non-meeting,Volunteer opportunity: Company team for charity run needs participants.
non-meeting,Your access to the confidential project folder has been granted.
non-meeting,System upgrade scheduled for this weekend. Plan accordingly.
meeting,Please attend the compliance training refresher meeting at 9:15 AM Thursday.
non-meeting,Please remember to update your profile in the employee directory.
non-meeting,We're pleased to announce several key client renewals this month.
non-meeting,We're pleased to announce a new tuition reimbursement program.
non-meeting,The company blood drive will take place in the main lobby on Friday.
meeting,Please attend the customer service meeting at 10:45 AM tomorrow.
non-meeting,We've updated our travel and entertainment expense policy.
non-meeting,We've revised our data classification policy; training scheduled.
non-meeting,New updates have been posted on the company website. Check out the blog for more information.
non-meeting,Please participate in the facilities satisfaction survey.
meeting,The annual performance review meetings will be held throughout next week.
non-meeting,We're excited to announce our new company values and mission.
non-meeting,Please review the draft of the product recall announcement.
non-meeting,We've updated our expense reporting guidelines; please review.
non-meeting,The annual inventory audit will begin next Monday.
non-meeting,The quarterly financial reports are now available in the shared drive.
meeting,The client onboarding meeting will take place at 10:45 AM in the main boardroom.
meeting,Please bring usage analytics to the product performance review at 4:30 PM tomorrow.
non-meeting,Your professional development course has been approved and registered.
meeting,The customer journey optimization meeting will begin at 11:30 AM in the experience design center.
non-meeting,Please remember to lock your computer when away from your desk.
non-meeting,Your business travel profile needs updating before next trip.
non-meeting,New leadership development program applications now open.
non-meeting,Your new project assignment details are attached to this email.
non-meeting,We're introducing a new expense reimbursement process next month.
meeting,The product feature prioritization meeting is set for 11:15 AM in the product lab.
non-meeting,New policy regarding use of personal devices at work.
non-meeting,The holiday schedule for next year has been published.
non-meeting,Your request for team collaboration space has been approved.
non-meeting,Please review and update your emergency evacuation role.
meeting,We're having a quick meeting at 2:30 PM to discuss project blockers.
non-meeting,We're proud to announce our company's inclusion in the Best Places to Work list.
meeting,The user experience workshop starts at 10:15 AM in the design thinking space.
non-meeting,Your request for additional team resources has been approved.
non-meeting,We need feedback on the proposed changes to the company logo.
meeting,Please join the accessibility compliance review at 9:30 AM in the inclusive design center.
meeting,The customer churn analysis meeting will take place at 3 PM in the retention strategy room.
non-meeting,Important update about changes to reporting structure.
meeting,We need to align on the annual marketing plan at 9 AM in the campaign strategy room.
non-meeting,Please complete the workspace satisfaction survey by the end of the week.
meeting,The leadership coaching session has been moved to 9:30 AM in the executive suite.
non-meeting,The deadline for updating beneficiary information is December 31st.
non-meeting,Your professional certification has been added to your employee profile.
non-meeting,Changes to the employee referral program now in effect.
non-meeting,The employee discount program now includes additional vendors.
non-meeting,Your continuing education credits need to be submitted this month.
non-meeting,Your requested training course has been approved and registered.
non-meeting,The office furniture will be rearranged this weekend.
non-meeting,Please complete the brief survey on workspace utilization.
non-meeting,We've revised our document retention policy; details attached.
non-meeting,Your team's project dashboard has been updated with new metrics.
non-meeting,The IT team has released a new version of our internal software.
non-meeting,Please remember to return temporary access badges to security.
meeting,The budget allocation committee meeting will take place at 11:15 AM Thursday.
meeting,The supplier diversity initiative kickoff will start at 11:30 AM in Room 503.
meeting,Please prepare for the budget planning meeting at 3:30 PM Monday.
non-meeting,We've updated our brand guidelines; new templates available.
non-meeting,Please submit your department's annual report by the end of month.
meeting,Please join the process improvement meeting at 2:30 PM in the operations center.
meeting,All team leaders should join the resource allocation meeting at 1 PM tomorrow.
meeting,All department representatives must attend the coordination meeting at 11:15 AM.
meeting,The customer advisory board meeting will take place at 11:30 AM at the Hilton.
meeting,The partner ecosystem strategy meeting will take place at 10:30 AM in the alliance management center.
non-meeting,Changes to the customer feedback collection process.
non-meeting,Please submit your suggestions for the holiday party theme.
meeting,We need to discuss the supply chain disruption at 1 PM in the logistics center.
meeting,The customer success metrics meeting will take place at 11:15 AM in Room 203.
meeting,The quarterly review is set for next Monday at 10 AM in the executive conference room.
meeting,The customer journey mapping session will begin at 10 AM in the design thinking room.
non-meeting,Please remember to return any borrowed office equipment.
non-meeting,Security badges must be displayed at all times while on premises.
non-meeting,We've updated our social media guidelines for employees.
non-meeting,I'm pleased to announce that Jane Smith has been promoted to Senior Director.
meeting,Your department's customer retention strategy meeting will take place at 1:30 PM in the loyalty program center.
non-meeting,Your training completion certificates are ready for download.
non-meeting,Please remember to properly dispose of confidential documents.
meeting,The annual budget planning meeting will run from 9 AM to 4 PM with lunch provided.
non-meeting,The company's annual financial report is now available for review.
meeting,The content strategy planning session will take place at 10:30 AM in the audience engagement center.
meeting,Please prepare for tomorrow's performance review meeting at 10:05 AM.
non-meeting,Your request for specialized training has been approved.
non-meeting,The deadline for participating in the employee stock purchase plan is Friday.
non-meeting,Please review the draft of the client proposal by Thursday.
non-meeting,Your request for reduced hours has been approved by management.
non-meeting,Your requested standing desk has been approved and ordered.
meeting,All department representatives must join the coordination meeting at 2:15 PM sharp.
non-meeting,We're pleased to announce that we've reached our annual charity goal.
non-meeting,The company newsletter submissions are due by the end of the week.
non-meeting,The annual company report is now available for distribution to stakeholders.
meeting,The product launch planning meeting will take place at 10 AM in Conference Room G.
non-meeting,Important information about year-end tax documentation.
non-meeting,We're switching to a new travel booking system effective immediately.
meeting,Your presence is requested at the emergency budget meeting at 5 PM today.
non-meeting,Your new business cards have arrived at the front desk.
non-meeting,Team photo session scheduled for next Thursday morning.
meeting,Please join the sustainability initiative kickoff at 3:30 PM in the green conference room.
non-meeting,Changes to the corporate travel booking procedures.
non-meeting,New benefits provider portal access instructions attached.
meeting,The technical debt reduction planning session will start at 1:30 PM in the engineering excellence center.
meeting,Please prepare your ideas for the innovation pipeline meeting at 1 PM tomorrow.
non-meeting,The deadline for updating your commuter benefit elections is approaching.
non-meeting,The deadline for submitting healthcare claims is December 31st.
non-meeting,We've updated our network password requirements effective immediately.
non-meeting,Your training request has been approved by management.
non-meeting,Your performance review documentation is due next Friday.
non-meeting,We're excited to announce our expansion into international markets.
meeting,The customer feedback meeting is scheduled for 10:30 AM Friday.
meeting,The business continuity planning session is set for 4:30 PM in the risk management office.
meeting,All department heads should join the strategy meeting at 9:30 AM tomorrow.
non-meeting,Your submitted article has been accepted for the company newsletter.
non-meeting,The building security systems will be tested tomorrow morning.
non-meeting,We're excited to welcome three new members to our executive team.
meeting,Please attend the facility management meeting at 3:15 PM in Operations.
non-meeting,The company vehicle fleet has been upgraded with hybrid models.
meeting,The quarterly review meeting is scheduled for 9 AM Monday. Please be on time.
non-meeting,Changes to the remote work policy effective immediately.
meeting,The vendor selection committee meeting will begin at 10:15 AM in Procurement.
non-meeting,Join us for our upcoming webinar on data science! Register now.
non-meeting,Reminder: Register devices brought from home with IT security.
non-meeting,Changes to the employee parking assignment system.
meeting,The community outreach planning meeting is scheduled for 11:30 AM in the social impact room.
non-meeting,Please verify your contact information for the company directory.
non-meeting,Changes to the reimbursement submission process.
non-meeting,Your document has been reviewed and approved.
meeting,The customer experience improvement workshop will begin at 4:30 PM in the journey mapping lab.
non-meeting,We're implementing a new supplier evaluation process next quarter.
non-meeting,Please submit your timesheet before leaving for the weekend.
non-meeting,Important update about the employee stock option plan.
non-meeting,Please update your personal information in the employee directory.
non-meeting,The employee handbook has been updated with new policies.
non-meeting,We've changed our policy for handling confidential information.
meeting,Don't forget about the workflow improvement meeting at 8:30 AM in Operations.
non-meeting,Technology refresh program schedule now available. Check your eligibility.
non-meeting,Your requested office supplies have been delivered.
non-meeting,We're pleased to announce our new corporate social responsibility program.
non-meeting,Your requested reference materials have been added to the library.
non-meeting,Your contribution to the successful project launch is appreciated.
non-meeting,Please review the draft of the crisis communication plan.
non-meeting,We're implementing new safety protocols in the production area.
non-meeting,Changes to the customer complaint handling procedure.
non-meeting,We've upgraded our network infrastructure for better performance.
non-meeting,Reminder: Complete the required safety training by end of month.
meeting,Reminder: Process improvement committee meeting at 9 AM in the operations center.
non-meeting,Reminder: Return borrowed tools to the maintenance department.
non-meeting,Reminder: Register your devices with IT security by Friday.
non-meeting,Reminder: All expense reports for this quarter are due by the 30th.
non-meeting,New ergonomic equipment options available through facilities.
non-meeting,Please submit your proposed conference presentation by August 15.
meeting,The customer experience improvement meeting will begin at 10:30 AM in Room 302.
non-meeting,Annual fire drill scheduled for next Thursday at 10 AM.
non-meeting,Please provide feedback on the proposed changes to the paid time off policy.
non-meeting,New vendor onboarding process effective immediately. Documentation attached.
non-meeting,The deadline for the internal job posting closes tomorrow at 5 PM.
non-meeting,We're pleased to announce our expansion into the Asian market.
meeting,Your department's strategic planning session is scheduled for 3 PM in the long-range planning room.
non-meeting,Your security clearance has been updated in the system.
non-meeting,Please remember to properly dispose of recyclable materials.
non-meeting,Important update regarding information security requirements.
non-meeting,The quarterly compliance report has been submitted successfully.
meeting,The partnership opportunity discussion is set for 11 AM with the business development team.
meeting,The product roadmap prioritization will begin at 1:30 PM in the strategy alignment room.
meeting,The strategic initiative kick-off meeting will take place at 9 AM in Conference Room H.
non-meeting,Important update to the leave request processing system.
non-meeting,The company's diversity and inclusion report is now available.
non-meeting,The network will be down for maintenance this Saturday night.
non-meeting,The company sports teams are looking for new participants.
meeting,The content strategy meeting will take place at 2 PM in the editorial room.
non-meeting,Please return any borrowed equipment before the inventory audit.
non-meeting,We've changed our process for requesting translation services.
non-meeting,Please return any unused office equipment to the IT department.
non-meeting,Your equipment is scheduled for maintenance next Tuesday.
meeting,The market research findings meeting is scheduled for 1 PM with the strategy team.
meeting,Please attend the compliance training meeting at 3:15 PM in the auditorium.
non-meeting,Join us for our upcoming webinar on data science! Register now.
non-meeting,Your training registration has been confirmed.
non-meeting,Your new company ID badge is ready for pickup at the security desk.
non-meeting,We've updated our company logo; new templates are available.
non-meeting,The printer maintenance schedule has been posted on the intranet.
non-meeting,The software licenses audit will be conducted next week.
meeting,Please join the team alignment session at 9:15 AM in the collaboration zone.
non-meeting,Your project proposal has been reviewed. Feedback attached.
non-meeting,Your professional development course has been approved.
non-meeting,Your request for team building budget has been approved.
non-meeting,Your team has been selected for recognition this quarter.
non-meeting,We've updated our company's mission statement and core values.
non-meeting,Annual benefits enrollment period begins next Monday.
meeting,We're holding a crisis management drill meeting at 2:30 PM with all response teams.
non-meeting,Your desk will be relocated to the east wing during the renovations.
meeting,The annual planning meeting will begin at 8:15 AM at the conference center.
non-meeting,The annual team photo day is scheduled for next Wednesday.
non-meeting,We've partnered with a new service provider for technical support.
meeting,Meeting scheduled for 2 PM. Don't forget to bring the financial report.
non-meeting,Please submit your professional development goals for the coming year.
non-meeting,We're proud to announce our new corporate social responsibility initiative.
meeting,We're scheduling a workflow optimization meeting at 2:30 PM in the operations area.
meeting,The crisis communication planning starts at 2:15 PM with PR and executive team.
non-meeting,Please remember to properly label all sensitive materials.
